{
  "version": 2,
  "mvp": {
    "wave": "4-foundation",
    "costModel": "hp",
    "notes": [
      "MVP uses HP cost only; no durability/stamina costs yet.",
      "Player-only command flow lands in a follow-up scene update.",
      "All catalog mechanics are implemented; structured effects live in each art's effects/combatMods blocks (no deferred placeholders remain)."
    ]
  },
  "areaXp": {
    "hitRate": 0.35,
    "killRate": 0.6,
    "actionBaseCap": 75
  },
  "arts": [
    {
      "id": "sword_precise_cut",
      "name": "Precise Cut",
      "weaponType": "Sword",
      "tierAffinity": "Iron",
      "unlockAct": "act1",
      "requiredRank": "Prof",
      "hpCost": 2,
      "perTurnLimit": 1,
      "perMapLimit": 3,
      "targeting": "normal_attack",
      "description": "A patient cut that finds the man behind the brush and stone.",
      "combatMods": {
        "hitBonus": 20,
        "critBonus": 5,
        "ignoreTerrainAvoid": true,
        "activated": [
          {
            "id": "weapon_art",
            "name": "Precise Cut"
          }
        ]
      }
    },
    {
      "id": "sword_wrath_strike",
      "name": "Wrath Strike",
      "weaponType": "Sword",
      "tierAffinity": "Iron",
      "unlockAct": "act1",
      "requiredRank": "Prof",
      "hpCost": 3,
      "perMapLimit": 3,
      "targeting": "normal_attack",
      "description": "Anger sharpens the swing, adding might and hit.",
      "combatMods": {
        "atkBonus": 5,
        "hitBonus": 10,
        "activated": [
          {
            "id": "weapon_art",
            "name": "Wrath Strike"
          }
        ]
      }
    },
    {
      "id": "sword_dueling_blade",
      "name": "Dueling Blade",
      "weaponType": "Sword",
      "tierAffinity": "Iron",
      "unlockAct": "act1",
      "requiredRank": "Prof",
      "hpCost": 4,
      "perMapLimit": 3,
      "targeting": "normal_attack",
      "description": "A duelist's guard turns aside almost any blow.",
      "combatMods": {
        "avoidBonus": 30,
        "activated": [
          {
            "id": "weapon_art",
            "name": "Dueling Blade"
          }
        ]
      }
    },
    {
      "id": "sword_grounder",
      "name": "Grounder",
      "weaponType": "Sword",
      "tierAffinity": "Iron",
      "unlockAct": "act1",
      "requiredRank": "Prof",
      "hpCost": 3,
      "perMapLimit": 3,
      "targeting": "normal_attack",
      "description": "A low sweep meant to cut fliers out of the sky.",
      "combatMods": {
        "effectiveness": {
          "moveTypes": [
            "flying"
          ],
          "multiplier": 3
        },
        "activated": [
          {
            "id": "weapon_art",
            "name": "Grounder"
          }
        ]
      },
      "spawnTiers": [
        "Iron",
        "Steel"
      ]
    },
    {
      "id": "sword_advancing_strike",
      "name": "Advancing Strike",
      "weaponType": "Sword",
      "tierAffinity": "Iron",
      "unlockAct": "act1",
      "requiredRank": "Prof",
      "hpCost": 4,
      "perMapLimit": 3,
      "targeting": "normal_attack",
      "description": "A lunge that ends with a free step into the gap.",
      "effects": {
        "afterCombat": [
          {
            "type": "move",
            "mode": "advance",
            "distance": 1
          }
        ]
      },
      "combatMods": {
        "activated": [
          {
            "id": "weapon_art",
            "name": "Advancing Strike"
          }
        ]
      }
    },
    {
      "id": "sword_comet_edge",
      "name": "Comet Edge",
      "weaponType": "Sword",
      "tierAffinity": "Steel",
      "legacy": true,
      "unlockAct": "act2",
      "requiredRank": "Prof",
      "hpCost": 4,
      "perTurnLimit": 1,
      "perMapLimit": 2,
      "targeting": "normal_attack",
      "description": "The old duelists' finisher, all precision and crit.",
      "combatMods": {
        "atkBonus": 3,
        "hitBonus": 10,
        "critBonus": 10,
        "activated": [
          {
            "id": "weapon_art",
            "name": "Comet Edge"
          }
        ]
      }
    },
    {
      "id": "sword_windsweep",
      "name": "Windsweep",
      "weaponType": "Sword",
      "tierAffinity": "Steel",
      "unlockAct": "act2",
      "requiredRank": "Prof",
      "hpCost": 6,
      "perMapLimit": 2,
      "targeting": "normal_attack",
      "description": "So fast the enemy never gets to answer it.",
      "combatMods": {
        "preventCounter": true,
        "hitBonus": 10,
        "activated": [
          {
            "id": "weapon_art",
            "name": "Windsweep"
          }
        ]
      }
    },
    {
      "id": "sword_hexblade",
      "name": "Hexblade",
      "weaponType": "Sword",
      "tierAffinity": "Steel",
      "unlockAct": "act2",
      "requiredRank": "Prof",
      "hpCost": 6,
      "perMapLimit": 2,
      "targeting": "normal_attack",
      "description": "Cursed steel that bites resistance, not armor.",
      "combatMods": {
        "targetsRES": true,
        "atkBonus": 3,
        "hitBonus": 10,
        "activated": [
          {
            "id": "weapon_art",
            "name": "Hexblade"
          }
        ]
      }
    },
    {
      "id": "sword_lunge",
      "name": "Lunge",
      "weaponType": "Sword",
      "tierAffinity": "Steel",
      "unlockAct": "act2",
      "requiredRank": "Prof",
      "hpCost": 6,
      "perMapLimit": 2,
      "targeting": "normal_attack",
      "description": "The thrust ends with you and the target trading places.",
      "effects": {
        "afterCombat": [
          {
            "type": "move",
            "mode": "swap",
            "distance": 1
          }
        ]
      },
      "combatMods": {
        "atkBonus": 3,
        "hitBonus": 10,
        "activated": [
          {
            "id": "weapon_art",
            "name": "Lunge"
          }
        ]
      }
    },
    {
      "id": "sword_seal_speed",
      "name": "Seal Speed",
      "weaponType": "Sword",
      "tierAffinity": "Steel",
      "unlockAct": "act2",
      "requiredRank": "Prof",
      "hpCost": 6,
      "perMapLimit": 2,
      "targeting": "normal_attack",
      "description": "A cut to the tendons that slows the target's feet.",
      "effects": {
        "afterCombat": [
          {
            "type": "debuff",
            "target": "defender",
            "stat": "SPD",
            "amount": -4
          }
        ]
      },
      "combatMods": {
        "atkBonus": 3,
        "hitBonus": 10,
        "activated": [
          {
            "id": "weapon_art",
            "name": "Seal Speed"
          }
        ]
      }
    },
    {
      "id": "sword_poison_strike",
      "name": "Poison Strike",
      "weaponType": "Sword",
      "tierAffinity": "Steel",
      "unlockAct": "act2",
      "requiredRank": "Prof",
      "hpCost": 5,
      "perMapLimit": 2,
      "targeting": "normal_attack",
      "description": "Venom on the edge keeps working once blades part.",
      "effects": {
        "afterCombat": [
          {
            "type": "damage",
            "target": "defender",
            "amount": 5,
            "nonLethal": true
          }
        ]
      },
      "combatMods": {
        "atkBonus": 3,
        "hitBonus": 10,
        "activated": [
          {
            "id": "weapon_art",
            "name": "Poison Strike"
          }
        ]
      }
    },
    {
      "id": "sword_finesse_blade",
      "name": "Finesse Blade",
      "weaponType": "Sword",
      "tierAffinity": "Silver",
      "unlockAct": "act3",
      "requiredRank": "Prof",
      "hpCost": 7,
      "perMapLimit": 3,
      "targeting": "normal_attack",
      "description": "The keener your skill, the harder this one lands.",
      "allowedFactions": [
        "player"
      ],
      "combatMods": {
        "statScaling": {
          "stat": "SKL",
          "divisor": 2
        },
        "hitBonus": 15,
        "activated": [
          {
            "id": "weapon_art",
            "name": "Finesse Blade"
          }
        ]
      }
    },
    {
      "id": "sword_shadow_gambit",
      "name": "Shadow Gambit",
      "weaponType": "Sword",
      "tierAffinity": "Silver",
      "unlockAct": "act3",
      "requiredRank": "Prof",
      "hpCost": 6,
      "perMapLimit": 3,
      "targeting": "normal_attack",
      "description": "Feint past cover the ground can no longer shield.",
      "allowedFactions": [
        "player"
      ],
      "combatMods": {
        "critBonus": 20,
        "hitBonus": 15,
        "ignoreTerrainAvoid": true,
        "activated": [
          {
            "id": "weapon_art",
            "name": "Shadow Gambit"
          }
        ]
      }
    },
    {
      "id": "sword_dragonhaze",
      "name": "Dragonhaze",
      "weaponType": "Sword",
      "tierAffinity": "Silver",
      "unlockAct": "act3",
      "requiredRank": "Prof",
      "hpCost": 7,
      "perMapLimit": 3,
      "targeting": "normal_attack",
      "description": "Faster hands mean a heavier blow; it scales on Speed.",
      "allowedFactions": [
        "player"
      ],
      "combatMods": {
        "statScaling": {
          "stat": "SPD",
          "divisor": 2
        },
        "hitBonus": 15,
        "activated": [
          {
            "id": "weapon_art",
            "name": "Dragonhaze"
          }
        ]
      }
    },
    {
      "id": "sword_astra_strike",
      "name": "Astra Strike",
      "weaponType": "Sword",
      "tierAffinity": "Silver",
      "unlockAct": "act3",
      "requiredRank": "Prof",
      "hpCost": 7,
      "perMapLimit": 3,
      "targeting": "normal_attack",
      "description": "A flurry of quick, light cuts too fast to follow.",
      "allowedFactions": [
        "player"
      ],
      "combatMods": {
        "multiHit": {
          "count": 3,
          "damageMultiplier": 0.6
        },
        "hitBonus": 10,
        "activated": [
          {